0,1,Year,Language,Rank[a],Title,Production company,Distributor,Worldwide gross,Ref.,Opening,Opening.1,Director,Cast,Studio (production house)
#,Implies that the film is multilingual and the gross collection figure includes the worldwide collection of the other simultaneously filmed version.,2025,hindi,,,,,,,,,,,
,,2025,hindi,1.0,Dhurandhar,Jio StudiosB62 Studios,Jio StudiosPVR Inox Pictures,"₹1,349.65 crore",[1][2],,,,,
,,2025,hindi,2.0,Chhaava,Maddock Films,Pen MarudharYash Raj Films,₹797.34 crore,[3][2],,,,,
,,2025,hindi,3.0,Saiyaara,Yash Raj Films,Yash Raj Films,₹579.23 crore,[4][2],,,,,
,,2025,hindi,4.0,Mahavatar Narsimha[α],Kleem Productions,AA Films,₹326.82 crore,[b],,,,,
,,2025,hindi,5.0,War 2,Yash Raj Films,Yash Raj Films,₹303–351 crore,[10][2][11],,,,,
,,2025,hindi,6.0,Sitaare Zameen Par,Aamir Khan Productions,PVR Inox PicturesAA Films,₹266.49 crore,[12][2],,,,,
,,2025,hindi,7.0,Raid 2,T-Series FilmsPanorama Studios,PVR Inox PicturesPanorama Studios,₹243.06 crore,[13][2],,,,,
,,2025,hindi,8.0,Housefull 5,Nadiadwala Grandson Entertainment,Pen Marudhar,₹242.80–248.80 crore,[14][15][2],,,,,
,,2025,hindi,9.0,Sikandar,Nadiadwala Grandson EntertainmentSalman Khan Films,Pen Marudhar,₹176.18 crore,[16][2],,,,,
,,2025,hindi,10.0,Thamma,Maddock Films,PVR Inox PicturesYash Raj Films,₹169.75 crore,[17][2],,,,,
,,2025,hindi,,The Rabbit House,,,,[18],J A N,3.0,Vaibhav Kulkarni,"Amit RiyaanKarishmaPadmanabh, Gagan PradeepPreeti SharmaSuresh Kumbhar",Geetai Productions
,,2025,hindi,,Fateh,,,,[19],J A N,10.0,Sonu Sood,Sonu SoodNaseeruddin ShahJacqueline Fernandez,"Zee Studios, Shakti Sagar Productions"
,,2025,hindi,,Match Fixing,,,,[20],J A N,10.0,Kedar Gaekwad,Vineet Kumar SinghRaj ArjunShataf FigarAnuja Sathe,Artarena Creations
,,2025,hindi,,Emergency,,,,[21],J A N,17.0,Kangana Ranaut,Kangana RanautAnupam KherShreyas TalpadeMahima ChaudhryMilind SomanSatish Kaushik,"Zee Studios, Manikarnika Films"
,,2025,hindi,,Azaad,,,,[22],J A N,17.0,Abhishek Kapoor,Ajay DevgnDiana PentyAaman DevganRasha ThadaniMohit MalikPiyush Mishra,"RSVP Movies, Guy In The Sky Pictures"
,,2025,hindi,,Mission Grey House,,,,[23],J A N,17.0,Naushad Siddiqui,Abeer KhanPuja SharmaRajesh SharmaKiran KumarNikhat KhanKamlesh SawantRaza Murad,"Reliance Entertainment, Rafat Films Entertainment"
,,2025,hindi,,Sangee,,,,[24][25],J A N,17.0,Sumit Kulkarni,Sharib HashmiSanjay BishnoiGaurav MoreVidya MalvadeShyamraj PatilMartin Jishil,"Yantrana Films, Armoks Films"
,,2025,hindi,,Hisaab Barabar,,,,[26],J A N,24.0,Ashwni Dhir,R. MadhavanNeil Nitin MukeshKirti KulhariRashami Desai,"Jio Studios, SP Cinecorp, ZEE5"
,,2025,hindi,,Sky Force,,,,[27],J A N,24.0,Sandeep KewlaniAbhishek Anil Kapur,Akshay KumarVeer PahariyaSara Ali KhanNimrat Kaur,"Jio Studios, Maddock Films, Leo Films"
,,2025,hindi,,Sweet Dreams,,,,[28],J A N,24.0,Victor Mukherjee,Amol ParasharMithila Palkar,"Jio Studios, Mango People Media, Disney+Hotstar"
,,2025,hindi,,The Storyteller,,,,[29],J A N,28.0,Anant Mahadevan,Paresh RawalAdil HussainRevathiTannishtha Chatterjee,"Jio Studios, Purpose Entertainment, Quest Films, Disney+Hotstar"
,,2025,hindi,,Deva,,,,[30],J A N,31.0,Rosshan Andrrews,Shahid KapoorPooja Hegde,"Zee Studios, Roy Kapur Films"
,,2025,hindi,,Loveyapa,,,,[31],F E B,7.0,Advait Chandan,Khushi KapoorJunaid Khan,"Zee Studios, Phantom Studios, AGS Entertainment"
,,2025,hindi,,Badass Ravi Kumar,,,,[32],F E B,7.0,Keith Gomes,Himesh ReshammiyaPrabhu DevaKirti KulhariSonia KapoorRajesh SharmaJohny LeverNavneet NishanManish WadhwaSanjay MishraAnil George,Himesh Reshammiya Melodies
,,2025,hindi,,Mrs.,,,,[33],F E B,7.0,Aarti Kadav,Sanya MalhotraNishant DahiyaKanwaljit Singh,"Jio Studios, Baweja Studios, ZEE5"
,,2025,hindi,,The Mehta Boys,,,,[34],F E B,7.0,Boman Irani,Boman IraniAvinash Tiwary,"Irani Movietone, Chalkboard Entertainment, Amazon Prime Video"
,,2025,hindi,,Bobby Aur Rishi Ki Love Story,,,,[35],F E B,11.0,Kunal Kohli,Vardhan PuriKaveri Kapur,"Jio Studios, The Production Headquarters, The Indian Scion Production, Disney+Hotstar"
,,2025,hindi,,Chhaava,,,,[36],F E B,14.0,Laxman Utekar,Vicky KaushalRashmika MandannaAkshaye Khanna,Maddock Films
,,2025,hindi,,Dhoom Dhaam,,,,[37],F E B,14.0,Rishab Seth,Pratik GandhiYami Gautam,"Jio Studios, B62 Studios, Netflix"
,,2025,hindi,,Mere Husband Ki Biwi,,,,[38],F E B,21.0,Mudassar Aziz,Arjun KapoorRakul Preet SinghBhumi Pednekar,Pooja Entertainment
,,2025,hindi,,Kaushaljis vs Kaushal,,,,[39],F E B,21.0,Seemaa Desai,Ashutosh RanaSheeba ChadhaIsha TalwarPavail Gulati,"Jio Studios, Merry Go Round Studios, Mumbai Talkeez, JioHotstar"
,,2025,hindi,,Shaila,,,,[40],F E B,28.0,Saki Shah,Rohit ChaudharySara KhanSonam AroraAadhvikaaDurvesh RameshwaramHussain KhanKetan Raj Sharma,"Reliance Entertainment, Riyom Films"
,,2025,hindi,,Crazxy,,,,[41],F E B,28.0,Girish Kohli,Sohum Shah,Sohum Shah Films
,,2025,hindi,,Superboys of Malegaon,,,,[42],F E B,28.0,Reema Kagti,Adarsh GouravVineet Kumar SinghShashank AroraAnuj Singh Duhan,"Amazon MGM Studios, Excel Entertainment, Tiger Baby Films"
,,2025,hindi,,Dil Dosti Aur Dogs,,,,[43],F E B,28.0,Viral Shah,Neena GuptaMasumeh MakhijaSharad KelkarKunaal Roy KapurKeerti Gaekwad KelkarTinu AnandEhan BhatTridha Choudhury,"Jio Studios, The Creative Tribe, JioHotstar"
,,2025,hindi,,Nadaaniyan,,,,[44],M A R,7.0,Shauna Gautam,Ibrahim Ali KhanKhushi KapoorMahima ChaudhrySuniel ShettyDia MirzaJugal Hansraj,"Dharmatic Entertainment, Netflix"
,,2025,hindi,,Riwaj,,,,[45],M A R,7.0,Manoj Sati,Myra SareenAftab ShivdasaniAdhvik MahajanMithun ChakrabortyAnita RajJaya Prada,"Kashish Khan Production, ZEE5"
,,2025,hindi,,The Diplomat,,,,[46],M A R,14.0,Shivam Nair,John AbrahamSadia KhateebRevathyKumud Mishra,"T-Series Films, JA Entertainment, Wakaoo Films, Fortune Pictures"
,,2025,hindi,,My Melbourne,,,,[47][48],M A R,14.0,Kabir KhanRima DasOnirImtiaz Ali,Ryanna SkyeKat StewartJake RyanArushi SharmaJackson GallagherArka Das,"Screen Australia, VicScreen, Mind Blowing Entertainment, Mind Blowing World, Soundfirm Post Production, Anticlock Films, Flying River Films, Window Seat Films, Kabir Khan Films"
,,2025,hindi,,Be Happy,,,,[49],M A R,14.0,Remo D'Souza,Abhishek BachchanNora FatehiNassarInayat VermaJohnny LeverHarleen Sethi,"Remo D'Souza Entertainment, Amazon Prime Video"
,,2025,hindi,,Inn Galiyon Mein,,,,[50],M A R,14.0,Avinash Das,Vivaan ShahAvantika DassaniJaved Jaffrey,Yadunath Films
,,2025,hindi,,Aachari Baa,,,,[51],M A R,14.0,Hardik Gajjar,Neena GuptaVatsal ShethApoorva AroraKabir Bedi,"Jio Studios, Hardik Gajjar Films, Backbencher Pictures"
,,2025,hindi,,Baida,,,,[52],M A R,21.0,Puneet Sharma,Sudhanshu RaiManisha RaiShobhit Sujay,MNM Entertainment
,,2025,hindi,,Tumko Meri Kasam,,,,[53],M A R,21.0,Vikram Bhatt,Anupam KherIshwak SinghAdah SharmaEsha Deol,Indira Entertainment
,,2025,hindi,,Pintu Ki Pappi,,,,[54],M A R,21.0,Shiv Hare,ShushantJaanyaa JoshiViidhiGanesh AcharyaMurali SharmaVijay Raaz,"Mythri Movie Makers, V2S Production & Entertainment"
,,2025,hindi,,Sikandar,,,,[55][56],M A R,30.0,AR Murugadoss,Salman KhanKajal AggarwalRashmika MandannaSathyarajPrateik Babbar,"Nadiadwala Grandson Entertainment, Salman Khan Films"
,,2025,hindi,,Jaat,,,,[57],A P R,10.0,Gopichand Malineni,Sunny DeolRandeep HoodaRegina CassandraSaiyami Kher,"Mythri Movie Makers, People Media Factory"
,,2025,hindi,,Chhorii 2,,,,[58],A P R,11.0,Vishal Furia,Nushrratt BharucchaSoha Ali KhanGashmeer MahajaniSaurabh GoyalPallavi AjayKuldeep SareenHardika Sharma,"T-Series Films, Abundantia Entertainment, Pshych Film, Tamarisk Lane, Amazon Prime Video"
,,2025,hindi,,Kesari Chapter 2,,,,[59],A P R,18.0,Karan Singh Tyagi,Akshay KumarR. MadhavanAnanya Panday,"Dharma Productions, Cape Of Good Films, Leo Media Collective"
,,2025,hindi,,Logout,,,,[60],A P R,18.0,Amit Golani,Babil KhanRasika DugalGandharv DewanNimisha Nair,"Viacom18 Studios, Posham Pa Pictures, ZEE5"
,,2025,hindi,,The Secret of Devkaali,,,,[61][62],A P R,18.0,Niraj Chauhan,Niraj ChauhanBhumika GurungMahesh ManjrekarRamkrishan Dhakad,Chauhan Production
,,2025,hindi,,Ground Zero,,,,[63],A P R,25.0,Tejas Prabha Vijay Deoskar,Emraan HashmiSai TamhankarZoya HussainMukesh TiwariLalit Prabhakar,"Excel Entertainment, Dreamzkrraft Entertainment, Talisman Films"
,,2025,hindi,,Jewel Thief,,,,[64],A P R,25.0,Kookie GulatiRobbie Garewal,Saif Ali KhanJaideep AhlawatNikita DuttaKunal Kapoor,"Marflix Pictures, Netflix"
,,2025,hindi,,Phule,,,,[65],A P R,25.0,Anant Mahadevan,Pratik GandhiPatralekha,"Zee Studios, Dancing Shiva Films, Kingsmen Productions"
,,2025,hindi,,Oye Bhootni Ke,,,,[66],A P R,25.0,Ajay Kailash Yadav,Mahaakshay ChakrabortyNikita SharmaDiana KhanAshoka ThackurChahat Mughal,"Sahatyam Films, Vision Motion Films"
,,2025,hindi,,Raid 2,,,,[67],M A Y,1.0,Raj Kumar Gupta,Ajay DevgnRiteish DeshmukhVaani Kapoor,"T-Series Films, Panorama Studios"
,,2025,hindi,,The Bhootnii,,,,[68],M A Y,1.0,Sidhaant Sachdev,Sanjay DuttMouni RoySunny SinghPalak TiwariBeyounickAasif Khan,"Soham Rockstar Entertainment, Three Dimension Motion Pictures"
,,2025,hindi,,Costao,,,,[69],M A Y,1.0,Sejal Shah,Nawazuddin SiddiquiPriya BapatKishore Kumar GGagan Dev Riar,"Bhanushali Studios, Bombay Fables, ZEE5"
,,2025,hindi,,The Networker,,,,[70],M A Y,9.0,Vikas Kumar Vishwakarma,Vikram KochharDurgesh KumarIshtiyak KhanRishabh PathakBrijendra KalaVindhya TiwariNikhat Khan,"Gutargoo Entertainment, Navritu Films"
,,2025,hindi,,Romeo S3,,,,[71],M A Y,16.0,Guddu Dhanoa,Thakur Anoop SinghPalak Tiwari,"Pen Studios, Wild River Pictures"
,,2025,hindi,,Bhool Chuk Maaf,,,,[72],M A Y,23.0,Karan Sharma,Rajkummar RaoWamiqa Gabbi,"Amazon MGM Studios, Maddock Films"
,,2025,hindi,,Kapkapiii,,,,[73],M A Y,23.0,Sangeeth Sivan,Tusshar KapoorShreyas TalpadeJay ThakkarSiddhi Idnani,"Zee Studios, Bravo Entertainment"
,,2025,hindi,,Pune Highway,,,,[74],M A Y,23.0,Rahul da CunhaBugs Bhargava Krishna,Jim SarbhAmit SadhManjari FadnisKetaki Narayan,"Drop D Films, Ten Years Younger Productions"
,,2025,hindi,,Kesari Veer,,,,[75],M A Y,23.0,Prince Dhiman,Suniel ShettyVivek OberoiSooraj PancholiAkansha Sharma,Chauhan Studios
,,2025,hindi,,Chidiya,,,,[76],M A Y,30.0,Mehran Amrohi,Vinay PathakAmruta Subhash Svar KambleAyush Pathak,"Smiley Films, Key Media Works"
,,2025,hindi,,Interrogation,,,,[77],M A Y,30.0,Ajoy Varma Raja,Manu SinghRajpal Yadav Darshan JariwalaYashpal SharmGirish Kulkarni,"Aryan Brothers Entertainment Film, Naam Mein Kya Rakha Hai Production, ZEE5"
,,2025,hindi,,Stolen,,,,[78],J U N,4.0,Karan Tejpal,Abhishek BanerjeeHarish KhannaMia MaelzerSahidur RahamanShubham Vardhan,"Jungle Book Studio, Amazon Prime Video"
,,2025,hindi,,Housefull 5,,,,[79][80],J U N,6.0,Tarun Mansukhani,Akshay KumarRiteish DeshmukhSanjay DuttAbhishek BachchanNana PatekarFardeen KhanDino MoreaChunky PandeyJackie ShroffNikitin DheerShreyas TalpadeRanjeetJohnny LeverJacqueline FernandezNargis FakhriSonam BajwaChitrangda SinghSoundarya Sharma,Nadiadwala Grandson Entertainment
,,2025,hindi,,Sitaare Zameen Par,,,,[81],J U N,20.0,R. S. Prasanna,Aamir KhanGenelia Deshmukh,Aamir Khan Productions
,,2025,hindi,,Detective Sherdil,,,,[82],J U N,20.0,Ravi Chhabriya,Diljit DosanjhDiana PentyBoman IraniChunky PandayRatna Pathak ShahBanita SandhuSumeet Vyas,"AAZ Films, Offside Entertainment, Maurya Entertainment, ZEE5"
,,2025,hindi,,Maa,,,,[83],J U N,27.0,Vishal Furia,KajolRonit RoyIndraneil SenguptaKherin Sharma,"Jio Studios, Devgn Films, Panorama Studios"
,,2025,hindi,,Well Done C.A Sahab!,,,,[84],J U N,27.0,Sarvesh Kumar Singh,Gopal DattGaurav PaswalaJyoti KapoorSayandeep SenguptaNishma SoniArchan TrivediMakrand ShuklaSamar JajoriyaSam JajoriyaRama Krishna Dixit,Figures and Frames
,,2025,hindi,,,,,,,J U N,,,,
,,2025,hindi,,,,,,,J U N,,,,
,,2025,hindi,,Metro... In Dino,,,,[85],J U L,4.0,Anurag Basu,Aditya Roy KapurSara Ali KhanAnupam KherNeena GuptaPankaj TripathiKonkona Sen SharmaAli FazalFatima Sana Shaikh,"T-Series Films, Anurag Basu Productions"
,,2025,hindi,,Kaalidhar Laapata,,,,[86],J U L,4.0,Madhumita,Abhishek BachchanDaivik BhagelaMohammed Zeeshan Ayyub,"Zee Studios, Emmay Entertainment, ZEE5"
,,2025,hindi,,Akshardham: Operation Vajra Shakti,,,,[87],J U L,4.0,Ken Ghosh,Akshaye Khanna Gautam RodeVivek DahiyaAkshay OberoiAbhilash ChaudharyParvin DabasSamir SoniAbhimanyu SinghMir SarwarManjari FadnisChandan RoyShivam Bhaargava,"Zee Studios, Contiloe Pictures"
,,2025,hindi,,Maalik,,,,[88],J U L,11.0,Pulkit,Rajkummar RaoManushi ChhillarProsenjit Chatterjee,"Tips Industries, Northern Lights Films"
,,2025,hindi,,Aankhon Ki Gustaakhiyan,,,,[89],J U L,11.0,Santosh Singh,Vikrant MasseyShanaya Kapoor,"Zee Studios, Mini Films"
,,2025,hindi,,Aap Jaisa Koi,,,,[90],J U L,11.0,Vivek Soni,R. MadhavanFatima Sana Shaikh,"Dharmatic Entertainment, Netflix"
,,2025,hindi,,Saiyaara,,,,[91],J U L,18.0,Mohit Suri,Ahaan PandayAneet Padda,Yash Raj Films
,,2025,hindi,,Tanvi the Great,,,,[92],J U L,18.0,Anupam Kher,Anupam KherShubhangi DuttIain GlenBoman IraniJackie ShroffArvind SwamiPallavi JoshiKaran TackerNassar,"Excel Entertainment, NFDC, Anupam Kher Studio"
,,2025,hindi,,Nikita Roy,,,,[93],J U L,18.0,Kussh Sinha,Sonakshi SinhaArjun RampalParesh RawalSuhail Nayyar,"Nicky Vicky Bhagnani Films, Kratos Entertainment, Nikita Pai Films"
,,2025,hindi,,Murderbaad,,,,[94],J U L,18.0,Arnab Chatterjee,Nakul Roshan SahdevKanikka KapurSharib HashmiAmole GupteSaloni Batra,"Reliance Entertainment, ACjee Entertainment"
,,2025,hindi,,Sant Tukaram,,,,[95],J U L,18.0,Aditya Om,Subodh BhaveSheena ChohanSanjay MishraArun Govil,Curzon Films
,,2025,hindi,,Mahavatar Narsimha[α],,,,[96],J U L,25.0,Ashwin Kumar,Animated characters,"Hombale Films, Kleem Productions"
,,2025,hindi,,So Long Valley,,,,[97],J U L,25.0,Man Singh,Tridha ChoudhuryAkanksha PuriVikram KochharAlisha ParveenPankaj Choudhary,Sourya Studios
,,2025,hindi,,Sarzameen,,,,[98],J U L,25.0,Kayoze Irani,Prithviraj SukumaranKajolIbrahim Ali Khan,"Star Studios, Dharma Productions, JioHotstar"
,,2025,hindi,,Rasa,,,,[99],J U L,25.0,Angith JayarajPreetish Jayaraj,Shishir SharmaRishi BissaVishishtha ChawlaRajiv Kumar,"Purnam Films, Haroon Rashid Films, Vidya Entertainment"
,,2025,hindi,,Dhadak 2,,,,[100],A U G,1.0,Shazia Iqbal,Siddhant ChaturvediTriptii Dimri,"Zee Studios, Dharma Productions, Cloud 9 Pictures"
,,2025,hindi,,Son of Sardaar 2,,,,[101],A U G,1.0,Vijay Kumar Arora,Ajay DevgnMrunal ThakurRavi Kishan,"Jio Studios, Devgn Films, YRV Studios"
,,2025,hindi,,Andaaz 2,,,,[102],A U G,8.0,Suneel Darshan,Aayush KumarAkaishaNatasha Fernandez,Shree Krishna International
,,2025,hindi,,Udaipur Files,,,,[103],A U G,8.0,Bharat Shrinat,Vijay RaazRajneesh DuggalPreeti JhangianiKanchi SinghKamlesh Sawant,Jani Firefox Films
,,2025,hindi,,Ghich Pich,,,,[104],A U G,8.0,Ankur Singla,Nitesh PandeySatyajit SharmaGeeta Agrawal SharmaKabir NandaAryan Singh RanaShhivam Kakar,"Barsaati Films, Platoon One Films"
,,2025,hindi,,War 2,,,,[105][106],A U G,14.0,Ayan Mukerji,Hrithik RoshanN. T. Rama Rao Jr.Kiara Advani,Yash Raj Films
,,2025,hindi,,Tehran,,,,[107],A U G,14.0,Arun Gopalan,John AbrahamNeeru BajwaManushi Chhillar,"Maddock Films, Bake My Cake Films, ZEE5"
,,2025,hindi,,Param Sundari,,,,[108],A U G,29.0,Tushar Jalota,Sidharth MalhotraJanhvi Kapoor,Maddock Films
,,2025,hindi,,Songs of Paradise,,,,[109],A U G,29.0,Danish Renzu,Soni RazdanSaba AzadZain Khan DurraniSheeba ChaddhaTaaruk Raina,"Excel Entertainment, Renzu Films, Apple Tree Pictures, Amazon Prime Video"
,,2025,hindi,,Baaghi 4,,,,[110],S E P,5.0,A. Harsha,Tiger ShroffSanjay DuttSonam BajwaHarnaaz Sandhu,Nadiadwala Grandson Entertainment
,,2025,hindi,,The Bengal Files,,,,[111],S E P,5.0,Vivek Agnihotri,Mithun ChakrabortyAnupam KherPuneet IssarGovind NamdevBabbu MaanPallavi JoshiPalomi Ghosh,"Abhishek Agarwal Arts, I Am Buddha"
,,2025,hindi,,Inspector Zende,,,,[112],S E P,5.0,Chinmay Mandlekar,Manoj BajpayeeJim SarbhBhalchandra KadamSachin KhedekarGirija OakHarish Dudhade,"Northern Lights Films, Netflix"
,,2025,hindi,,Ufff Yeh Siyapaa,,,,[113],S E P,5.0,G. Ashok,Soham ShahNushrratt BharucchaNora FatehiOmkar KapoorSharib Hashmi,Luv Films
,,2025,hindi,,Humans in the Loop,,,,[114],S E P,5.0,Aranya Sahay,Sonal MadhushankarRidhima SinghGita Guha,"Storiculture, Museum of Imagined Futures, SAUV Films"
,,2025,hindi,,Heer Express,,,,[115],S E P,12.0,Umesh Shukla,Divita JunejaAshutosh RanaSanjay MishraGulshan GroverPrit Kamani,"Tulip Entertainment, Divisa Entertainment, Merry Go Round Studios"
,,2025,hindi,,Love in Vietnam,,,,[116],S E P,12.0,Rahat Shah Kazmi,Shantanu MaheshwariAvneet KaurKhả Ngân,"Zee Studios, Blue Lotus Creatives, Innovations India, Rahat Kazmi Film Studios, Zebaish Entertainment, Tariq Khan Productions, Mango Tree Entertainment"
,,2025,hindi,,Ek Chatur Naar,,,,[117],S E P,12.0,Umesh Shukla,Divya Khosla KumarNeil Nitin Mukesh,"T-Series Films, Merry Go Round Studios"
,,2025,hindi,,Jugnuma: The Fable,,,,[118],S E P,12.0,Raam Reddy,Manoj BajpayeeDeepak DobriyalPriyanka BoseTillotama ShomeHiral SidhuAwan Pookot,"Prspctvs Productions, Maxmedia, Flip Films, Sikhya Entertainment"
,,2025,hindi,,Aabeer Gulaal,,,,[119],S E P,12.0,Aarti S. Bagdi,Fawad KhanVaani Kapoor,"A Richer Lens Entertainment, Aarjay Pictures"
,,2025,hindi,,Mannu Kya Karegga,,,,[120],S E P,12.0,Ssanjay Tripaathy,Vyom YadavSaachi BindraVinay PathakKumud MishraRajesh KumarCharu ShankarBrijendra Kala,Curious Eyes Cinema
,,2025,hindi,,Jolly LLB 3,,,,[121],S E P,19.0,Subhash Kapoor,Akshay KumarArshad WarsiHuma QureshiAmrita RaoSaurabh ShuklaGajraj Rao,"Star Studio18, Kangra Talkies"
,,2025,hindi,,Nishaanchi,,,,[122],S E P,19.0,Anurag Kashyap,Aaishvary ThackerayVedika PintoMonika PanwarMohammed Zeeshan Ayyub,"Amazon MGM Studios, JAR Pictures, Flip Films"
,,2025,hindi,,Ajey: The Untold Story of a Yogi,,,,[123],S E P,19.0,Ravindra Gautam,Anant JoshiParesh RawalDinesh Lal Yadav,Samrat Cinematics
,,2025,hindi,,Homebound,,,,[124],S E P,26.0,Neeraj Ghaywan,Ishaan KhatterVishal JethwaJanhvi Kapoor,Dharma Productions
,,2025,hindi,,Tu Meri Poori Kahani,,,,[125],S E P,26.0,Suhrita Das,Arhaan PateelShammi DuhanHirranya Ojha,Indira Entertainment
,,2025,hindi,,Sunny Sanskari Ki Tulsi Kumari,,,,[126],O C T,2.0,Shashank Khaitan,Varun DhawanJanhvi KapoorSanya MalhotraRohit Saraf,"Dharma Productions, Mentor Disciple Entertainment"
,,2025,hindi,,Lord Curzon Ki Haveli,,,,[127],O C T,10.0,Anshuman Jha,Arjun MathurRasika DugalTanmay DhananiaZoha Rahman,"Golden Ratio Films, First Ray Films, Jetty Productions"
,,2025,hindi,,Controll,,,,[128],O C T,10.0,Safdar Abbas,Thakur Anoop SinghRohit RoyPriya Anand,"Pen Studios, Yashi Studios"
,,2025,hindi,,Bhagwat: Chapter One – Raakshas,,,,[129],O C T,17.0,Akshay Shere,Arshad WarsiJitendra KumarAyesha Kaduskar,"Jio Studios, Baweja Studios, Dog ‘n’ Bone Pictures. ZEE5"
,,2025,hindi,,Greater Kalesh,,,,[130],O C T,17.0,Aditya Chandiok,Ahsaas ChannaSupriya Shukla,"Terrible Tinny Tales, Netflix"
,,2025,hindi,,WingMan (The Universal Irony of Love),,,,[131],O C T,17.0,Anuj Gulati,Shashank AroraTrimala AdhikariAuritra Ghosh,Lionsgate Play
,,2025,hindi,,Thamma,,,,[132],O C T,21.0,Aditya Sarpotdar,Ayushmann KhurranaRashmika MandannaNawazuddin SiddiquiParesh Rawal,Maddock Films
,,2025,hindi,,Ek Deewane Ki Deewaniyat,,,,[133],O C T,21.0,Milap Zaveri,Harshvardhan RaneSonam Bajwa,"Desi Movies Factory, Play DMF"
,,2025,hindi,,The Taj Story,,,,[134],O C T,31.0,Tushar Amrish Goel,Paresh RawalZakir HussainAmruta KhanvilkarSneha WaghNamit Das,Swarnim Global Services
,,2025,hindi,,Single Salma,,,,[135],O C T,31.0,Nachiket Samant,Huma QureshiSunny SinghShreyas Talpade,"Star Studio18, Elemen3 Entertainment"
,,2025,hindi,,Haq,,,,[136],N O V,7.0,Suparn Verma,Emraan HashmiYami Gautam,"Junglee Pictures, Insomnia Films, Baweja Studios"
,,2025,hindi,,Jatadhara[β],,,,[137],N O V,7.0,Venkat KalyanAbhishek Jaiswal,Sudheer BabuSonakshi SinhaDivya Khosla Kumar,"Zee Studios, Ess Kay Gee Entertainment, Sudheer Babu Productions"
,,2025,hindi,,Jassi Weds Jassi,,,,[138],N O V,7.0,Paran Bawa,Harshh Vardhan Singh DeoRehmat RattanRanvir ShoreySikandar KherManu Rishi Chadha,Divinity Studio
,,2025,hindi,,Baramulla,,,,[139],N O V,7.0,Aditya Suhas Jambhale,Manav KaulBhasha Sumbli,"Jio Studios, B62 Studios, Netflix"
,,2025,hindi,,De De Pyaar De 2,,,,[140],N O V,14.0,Anshul Sharma,Ajay DevgnR. MadhavanRakul Preet Singh,"T-Series Films, Luv Films"
,,2025,hindi,,Agra,,,,[141],N O V,14.0,Kanu Behl,Mohit AgarwalPriyanka BoseRuhani SharmaRahul Roy,"Saregama, UFO Moviez, O28 Films"
,,2025,hindi,,2020 Delhi,,,,[142],N O V,14.0,Devendra Malviya,Brijendra KalaSamar Jai SinghSiddharth Bharadwaj,Midas Touch Films
,,2025,hindi,,Kaal Trighori,,,,[143],N O V,14.0,Nitin Vaidya,Arbaaz KhanRituparna SenguptaMahesh ManjrekarAditya SrivastavaMugdha GodseRajesh Sharma,"Pen Studios, Navin Productions"
,,2025,hindi,,Nishaanchi 2,,,,[144],N O V,14.0,Anurag Kashyap,Aaishvary ThackerayVedika PintoMonika PanwarMohammed Zeeshan Ayyub,"Amazon MGM Studios, JAR Pictures, Flip Films, Amazon Prime Video"
,,2025,hindi,,120 Bahadur,,,,[145],N O V,21.0,Razneesh ‘Razy’ Ghai,Farhan AkhtarRaashii Khanna,"Excel Entertainment, Trigger Happy Studios"
,,2025,hindi,,Mastiii 4,,,,[146],N O V,21.0,Milap Zaveri,Riteish DeshmukhVivek OberoiAftab ShivdasaniArshad WarsiTusshar KapoorShreya SharmaElnaaz NorouziRuhi Singh,"Balaji Motion Pictures, Waveband Production, Maruti International"
,,2025,hindi,,Tere Ishk Mein,,,,[147],N O V,28.0,Aanand L. Rai,DhanushKriti Sanon,"T-Series Films, Colour Yellow Productions"
,,2025,hindi,,Gustaakh Ishq,,,,[148],N O V,28.0,Vibhu Puri,Naseeruddin ShahFatima Sana ShaikhVijay VarmaSharib Hashmi,Stage 5 Productions
,,2025,hindi,,Me No Pause Me Play,,,,[149],N O V,28.0,Samar K Mukharjee,Kamya PanjabiDeepshikha NagpalManoj Kumar SharmaAman VermaSudha Chandran,"Digi Filming, Mirrro Films"
,,2025,hindi,,Kaisi Ye Paheli,,,,[150],N O V,28.0,Ananyabrata Chakravorty,Rajit KapoorSukant GoelChittaranjan GiriSadhana Singh,Take Pictures
,,2025,hindi,,Dhurandhar,,,,[151],D E C,5.0,Aditya Dhar,Ranveer SinghAkshaye KhannaSanjay DuttArjun RampalR. MadhavanSara ArjunRakesh Bedi,"Jio Studios, B62 Studios"
,,2025,hindi,,Kis Kisko Pyaar Karoon 2,,,,[152],D E C,12.0,Anukalp Goswami,Kapil SharmaManjot SinghHira WarinaTridha ChoudhuryParul GulatiAyesha Khan,"Star Studio18, Venus Worldwide Entertainment, Abbas-Mustan Film Production"
,,2025,hindi,,Saali Mohabbat,,,,[153],D E C,12.0,Tisca Chopra,Radhika ApteDivyennduAnshumaan PushkarAnurag Kashyap,"Stage 5 Prdoction, Jio Studios, ZEE5"
,,2025,hindi,,The Great Shamsuddin Family,,,,[154],D E C,12.0,Anusha Rizvi,Kritika KamraShreya DhanwantharySheeba ChaddhaFarida JalalPurab Kohli,"Star Studio18, Third World Films Production, JioHotstar"
,,2025,hindi,,Raat Akeli Hai: The Bansal Murders,,,,[155],D E C,19.0,Honey Trehan,Nawazuddin SiddiquiRadhika ApteChitrangada SinghRajat KapoorRevathiDeepti NavalSanjay Kapoor,"RSVP Movies, MacGuffin Pictures"
,,2025,hindi,,Durlabh Prasad Ki Dusri Shadi,,,,[156],D E C,19.0,Siddhant Raj Singh,Sanjay MishraMahima Chaudhry,Eksha Entertainment
,,2025,hindi,,Tu Meri Main Tera Main Tera Tu Meri,,,,[157],D E C,25.0,Sameer Vidwans,Kartik AaryanAnanya PandayNeena GuptaJackie Shroff,"Dharma Productions, Namah Pictures"
